{
  "artifact": {
    "artifact_id": "art-s2",
    "artifact_schema": "ev4-architect-pipeline-stage-artifact@1.1.0",
    "artifact_sha256": "0089ebdbe10a7ca44fc60472aea9321ced0c07cfd0e7dd9f2bd7f86c4b8522df"
  },
  "authorization": {
    "authorization_reason": "generated_valid_receipt",
    "next_stage_authorized": true
  },
  "boundary_id": "asb-boundary-run-asb-fixture-decompose-0089ebdbe10a",
  "boundary_schema": "ev4-stage-boundary-record@1.0.0",
  "receipt": {
    "receipt_id": "asb-receipt-run-asb-fixture-art-s2-0089ebdbe10a",
    "receipt_schema": "ev4-architect-stage-validation-receipt@1.1.0",
    "receipt_sha256": "d7bc0c258d3b74b389553a5699d3d5b96d77a2002d1ac0628c92c9e7494c26fa",
    "status": "valid",
    "validator_id": "architect-pipeline-stage-boundary-validator",
    "validator_version": "1.1.0"
  },
  "repair_target_stage": null,
  "run_id": "run-asb-fixture",
  "source_stage": "/decompose",
  "target_stage": "/architectures",
  "transition": "next_stage"
}
