{
  "artifact": {
    "artifact_id": "art-s3",
    "artifact_schema": "ev4-architect-pipeline-stage-artifact@1.1.0",
    "artifact_sha256": "7b1b58d05819a26dd7715590078fed4445a3fbe21f8de254d848b808d35b000d"
  },
  "authorization": {
    "authorization_reason": "generated_valid_receipt",
    "next_stage_authorized": true
  },
  "boundary_id": "asb-boundary-run-asb-fixture-architectures-7b1b58d05819",
  "boundary_schema": "ev4-stage-boundary-record@1.0.0",
  "receipt": {
    "receipt_id": "asb-receipt-run-asb-fixture-art-s3-7b1b58d05819",
    "receipt_schema": "ev4-architect-stage-validation-receipt@1.1.0",
    "receipt_sha256": "86bd79b0bef32de55be4c661e5390dffc0769fdebcd7a17218652ce98ea84c50",
    "status": "valid",
    "validator_id": "architect-pipeline-stage-boundary-validator",
    "validator_version": "1.1.0"
  },
  "repair_target_stage": null,
  "run_id": "run-asb-fixture",
  "source_stage": "/architectures",
  "target_stage": "/score-evidence",
  "transition": "next_stage"
}
